{
  "id": "tac_metadata_prune_before_vector_rank_001",
  "series_key": "retrieval.metadata-prune-before-vector-rank",
  "layer": "tactic",
  "status": "active",
  "version": 1,
  "title": "Apply metadata pruning before vector ranking in hybrid retrieval",
  "summary": "For the current hybrid stack, prune by scope metadata before vector rank to prevent irrelevant candidates from affecting score fusion.",
  "action": "Filter candidate pools by project scope and transfer class before issuing vector ranking queries.",
  "source_case_refs": [
    "case_retrieval_scope_drift_001"
  ],
  "supporting_invariant_refs": [
    "inv_retrieval_scope_filtering_001"
  ],
  "evidence_refs": [
    "ev_mem_20260410_001"
  ],
  "tool_binding": [
    "hybrid-retrieval",
    "vector-index",
    "metadata-store"
  ],
  "tool_version_bounds": ">=1.0.0 <2.0.0",
  "environment_bounds": [
    "multi-project corpus",
    "metadata-filter-capable backend"
  ],
  "prerequisites": [
    "Each record has trusted scope metadata",
    "The retrieval adapter exposes a pre-ranking filter hook"
  ],
  "steps": [
    "Classify the request scope and allowed transfer boundaries",
    "Reject unauthorized layers or projects at planning time",
    "Issue backend queries only against the permitted candidate pool",
    "Rank and fuse the remaining candidates"
  ],
  "fallbacks": [
    "If pre-ranking filters are unavailable, return a degraded-mode warning and use exact metadata filtering after lexical retrieval only",
    "Escalate to evidence-only audit mode if scope metadata is incomplete"
  ],
  "rollback": [
    "Disable the hybrid pre-filter path",
    "Revert to exact metadata retrieval while the adapter is repaired"
  ],
  "revalidate_at": "2026-07-01T00:00:00Z",
  "validated_on": [
    "hybrid-retrieval 1.3.2",
    "vector-index 0.9.8"
  ],
  "confidence": 0.81,
  "created_at": "2026-04-10T11:15:00Z",
  "updated_at": "2026-04-10T11:15:00Z"
}
